{
  "schema_version": "1.0.0",
  "publication_id": "structures-r1-9a3f1c02",
  "supersedes": null,
  "discipline": "structures",
  "round": 1,
  "agent": {
    "id": "structures-agent",
    "model": "claude-opus-5",
    "prompt_version": "struct-v0.3",
    "run_id": "run_2026-08-11T14:02:11Z_7f21"
  },
  "design_space_ref": { "id": "uav-medium", "version": 1, "hash": "sha256:PLACEHOLDER_COMPUTED_BY_TOOLING" },
  "mission_ref": { "id": "ref-mission-A", "hash": "sha256:PLACEHOLDER" },
  "created_at": "2026-08-11T14:09:44Z",
  "status": "published",

  "validity": {
    "box": {
      "S_ref": [9.0, 24.0],
      "AR": [8.0, 22.0],
      "t_c": [0.09, 0.18],
      "sweep_c4": [0.0, 15.0],
      "W0": [450.0, 1150.0],
      "P_SL": [40.0, 160.0]
    },
    "extrapolation_policy": "reject"
  },

  "active_subspace": [
    { "variable": "AR", "sensitivity": 1.0, "method": "gradient_rms" },
    { "variable": "t_c", "sensitivity": 0.81, "method": "gradient_rms" },
    { "variable": "W0", "sensitivity": 0.44, "method": "gradient_rms" },
    { "variable": "S_ref", "sensitivity": 0.29, "method": "gradient_rms" },
    { "variable": "sweep_c4", "sensitivity": 0.06, "method": "gradient_rms" },
    { "variable": "P_SL", "sensitivity": 0.0, "method": "gradient_rms" }
  ],

  "conditioning": [
    {
      "coupling_variable": "n_z_ult",
      "assumed_value": 5.7,
      "units": "g",
      "source": { "type": "requirement", "publication_id": null, "note": "3.8 limit x 1.5, frozen by REQ set. Not negotiated." },
      "drift_tolerance": { "kind": "absolute", "value": 0.01 }
    },
    {
      "coupling_variable": "CL_max",
      "assumed_value": 1.6,
      "units": "-",
      "source": { "type": "seed", "publication_id": null, "note": "Seed value; aero had not published when this round started. Drives the critical gust/manoeuvre spanload." },
      "drift_tolerance": { "kind": "relative", "value": 0.10 }
    }
  ],

  "provides": [
    {
      "coupling_variable": "W_structure",
      "units": "kg",
      "surrogate": {
        "form": "analytic",
        "inputs": ["W0", "S_ref", "AR", "t_c", "sweep_c4", "n_z_ult"],
        "expression": "0.045 * (n_z_ult*W0)**0.55 * S_ref**0.55 * AR**0.5 * t_c**(-0.35) / cos(radians(sweep_c4))**0.5",
        "fit": { "n_train": 240, "r2": 0.981, "rmse": 4.8, "cv": "5-fold" },
        "sigma": { "form": "constant", "value": 6.0 }
      }
    }
  ],

  "constraints": [
    {
      "id": "STR.TIP_DEFL",
      "description": "Wing tip deflection at ultimate load must not exceed 10% of semispan. Binds at high aspect ratio and thin sections.",
      "requirement_ref": "REQ-DEFL",
      "sense": "le_zero",
      "normalization": { "kind": "limit_relative", "scale": 0.10, "description": "g = (delta/b - 0.10)/0.10; g=-0.2 means 20% margin on the deflection limit." },
      "criticality": "hard",
      "surrogate": {
        "form": "analytic",
        "inputs": ["W0", "S_ref", "AR", "t_c", "n_z_ult"],
        "expression": "(1.0e-9 * n_z_ult * W0 * AR**2.5 / (S_ref**0.5 * t_c**2) - 0.10) / 0.10",
        "fit": { "n_train": 240, "r2": 0.973, "rmse": 0.031, "cv": "5-fold" },
        "sigma": { "form": "constant", "value": 0.04 }
      },
      "reporting": {
        "physical_expression": "1.0e-9 * n_z_ult * W0 * AR**2.5 / (S_ref**0.5 * t_c**2)",
        "limit": 0.10,
        "units": "-"
      }
    },
    {
      "id": "STR.SPAR_DEPTH",
      "description": "Minimum spar cap depth for buildability and inspection access; thin high-AR wings run out of box depth.",
      "requirement_ref": null,
      "sense": "le_zero",
      "normalization": { "kind": "absolute_scale", "scale": 0.02, "description": "g = (0.055 - t_c*sqrt(S_ref/AR)) / 0.02, on root box depth in m." },
      "criticality": "hard",
      "surrogate": {
        "form": "analytic",
        "inputs": ["S_ref", "AR", "t_c"],
        "expression": "(0.055 - t_c * (S_ref/AR)**0.5 * 1.35) / 0.02",
        "fit": { "n_train": 240, "r2": 0.999, "rmse": 0.002, "cv": "analytic" }
      },
      "reporting": {
        "physical_expression": "t_c * (S_ref/AR)**0.5 * 1.35",
        "limit": 0.055,
        "units": "m"
      }
    }
  ],

  "objectives": [
    {
      "id": "STR.MASS",
      "direction": "minimize",
      "units": "kg",
      "surrogate": {
        "form": "analytic",
        "inputs": ["W0", "S_ref", "AR", "t_c", "sweep_c4", "n_z_ult"],
        "expression": "0.045 * (n_z_ult*W0)**0.55 * S_ref**0.55 * AR**0.5 * t_c**(-0.35) / cos(radians(sweep_c4))**0.5"
      }
    }
  ],

  "evidence": {
    "tool": { "name": "ASWING", "version": "5.99", "fidelity": "medium" },
    "method_ref": "Nonlinear beam + VLM; box sized to ultimate load, deflection from converged static aeroelastic solution.",
    "n_evaluations": 240,
    "doe": { "type": "lhs", "seed": 20260811 },
    "input_deck_refs": [
      { "uri": "s3://mdao-runs/structures/r1/base.asw", "sha256": "sha256:PLACEHOLDER", "media_type": "text/plain" }
    ],
    "convergence_notes": "11 of 240 cases failed to converge at AR>21 with t_c<0.10; excluded from the fit and the validity box was tightened to AR<=22 accordingly.",
    "known_limitations": "Spanload held at the seeded CL_max distribution; no gust load cases, no aeroelastic divergence check. Coefficients are illustrative, not a validated method."
  }
}
